0,1,2,3,4,5,6
job_a5370704125401ff,"Data Analyst / Researcher (m/f/div)
- job post",FLOCERT,,Vollzeit,"Fair global trade everyone can believe in


FLOCERT is a leading global certification body. Besides providing sole certification to Fairtrade, FLOCERT also offers an array of services to support companies in sourcing on Fairtrade principles, where no Fairtrade Standard applies.
Founded in 2003, FLOCERT remains mission-driven and dedicated to working with all types of organisations, from small producers to internationally recognised brands, in order to promote fairness in global trade. Our accreditation as a “Social Enterprise” demonstrates our commitment to social business values.
With six international offices conducting business in over 120 countries, FLOCERT specialises in offering global reach with local expertise. For more information, visit us at www.flocert.net

FLOCERT is currently looking for a
Data Analyst / Researcher (m/f/div)
full-time
Job Share: Full-time (38,5 hrs. p.w.)
Position is based in the FLOCERT GmbH Office in Bonn, Germany
The salary and benefit package depends upon qualifications and experience
Start date: as soon as possible
Description
FLOCERT is looking for a person to drive research, development and improvement of our assurance and information products, and to support internal data analytic and our digital future. Through this we want to highlight business opportunities/improvements and bring more data driven solutions and decision making into our core assurance service.
The ability to analyse data sources, be inquisitive and creative with data; connect data models to business needs to highlight its potential, and ability to present complex topics and information in a meaningful manner to a wide range of audiences is a must for this role!

The person will need to liaise with multicultural teams and partners to develop concepts, dashboards, data models, and information products for both internal and external customers, whilst continually innovating our business processes, our understanding of data, and its future potential.
Responsibilities
Research and develop FLOCERTs assurance, supporting data sets and information products
Lead the framing and conceptualization of data initiatives and services, its supporting infrastructure and information tools and coordinate developments
Assess potential partners and incubate early stages of development whilst incorporating operational unit to run and maintain solutions
Understand and model FLOCERT’s data in terms of variables, indices and hierarchies
Act as adviser on data related questions and highlight business opportunities together with the potential to innovate and leverage our data
Manage the design, development, and customization of concepts, dashboards, reports, and information services/processes together with internal and external partners
Gather, analyse, and document business needs and related functionalities
Research new trends and techniques relating to data (e.g. machine learning, AI, predictive analytics and their potential for FLOCERT)
Support FLOCERT’s data governance
Support with ad-hoc (non-standard) data requests
Qualifications
“Must haves”
University Degree in Economics, Business, data science, computing, mathematics or IT
Professional work experience as business/data analyst/data scientist of at least two years
Relevant experience in Business Intelligence / Presentation tools (Such as Power BI)
Curiosity and passion for data analysis and modelling
Strong analytical skills and data affinity (modelling and analysis)
Experience with SQL Databases, data preparation and data analysis
Strong dedication towards customer service
A pragmatic - solution oriented spirit
Project management experience
Positive attitude and ability to work independently (Being the expert)
Good communication skills and ability to present technical matters in a comprehensible way also to non-technical colleagues.
Very good knowledge of MS Office
Fluent in English verbal and written.
Team player with excellent interpersonal skills working in an intercultural working environment
Motivation for Fairtrade and sustainability
“Nice to have”
Technical knowledge of assurance, certification, international trade or supply chains
Knowledge of sustainability and human rights
Working experience in process analysis, optimization and/or harmonization
Understanding of Python and/or R Linear regression / statistics
Understanding of AI/Machine Learning
Understanding of additional languages, ideally Spanish, and/or French, German, Portuguese Italian",27Dec2021-11:28:16
job_d67d9677a404b003,"DWS - Technology Analyst (m/w/d) - Quality Assurance
- job post",Deutsche Bank,,,"(German version below)
Team:
Our Quality Assurance - Team is working closely with business departments and development teams to assure high quality of the project delivery. In scope of the Quality Assurance are cutting edge Asset Management Platforms like SimCorp Dimension (SCD), the Aladdin Front Office Platform or the internally developed Data Hubs. Our experienced Team of functional and technical Testing experts will be there to coach you to learn all you need to excel and develop in a challenging project environment.
Your Key Responsibilities:
Creation of test plans and test cases in line with the Testing Standards of Deutsche Bank
Communication and agreement of test scope and test results with business departments and development teams
Execution and documentation of manual and automated tests
Improve and extend the level of automation of our regression tests
Represent QA Organisation in front of the business and development departments
Your skills and experience:
Working experience in testing of major applications
Good technical understanding
Basic familiarity with Asset Management processes and terms
Bachelor´s degree or equivalent qualification/ or working experience
Able to communicate fluently in English
_______________________________________________________________
Team:
Unser Quality Assurance - Team arbeitet eng mit den Fachabteilungen und den Entwicklungsteams zusammen um eine hohe Qualität der Projekt Auslieferungen sicherzustellen. Im Fokus unserer Arbeit steht die Qualitätssicherung von Weiterentwicklungen für unsere modernen Standard Software Pakete wie SimCorp Dimension (SCD), das Front Office System Aladdin oder auch interne Entwicklungen für unsere Data Hubs. Unsere fachlich und technisch erfahrenen Experten unterstützen Sie gerne damit Sie den Herausforderungen in unserem dynamischen Projektumfeld gerecht werden können.
Ihre Aufgaben:
Erarbeitung von Testplänen und Testfällen gemäß den Teststandards der Deutschen Bank
Besprechung und Abstimmung von Testanforderungen und Testergebnissen mit den Fachabteilungen und Entwicklungsteams
Durchführung und Dokumentation von manuellen und automatisierten Tests
Verbesserung und Erweiterung des Automatisierungsgrades unserer Regressions- Tests
Vertretung der QA Abteilung gegenüber den Fachabteilungen und Entwicklungsteams
Ihre Qualifikationen:
Erfahrungen beim Test umfangreicher Software- Anwendungen
Gutes technisches Verständnis
Grundsätzliches Verständnis der Geschäftsprozesse und Begrifflichkeiten im Asset Management
Bachelor– Abschluss oder vergleichbare Ausbildung oder Berufserfahrung
Sehr gute Kenntnisse der englischen Sprache
Kontakt:
Stefanie Schumann
Tel. 06991043106
Unsere Werte bestimmen das Arbeitsumfeld, welches wir schaffen möchten – vielfältig, wertschätzend und offen für verschiedene Meinungen. Nur eine Unternehmenskultur, die eine Vielzahl von Perspektiven, sowie kulturellen und gesellschaftlichen Hintergründen vereint, fördert Innovation. Wir setzten auf vielfältige Teams, in welchen die Menschen ihr volles Potential entfalten können – denn das Zusammenführen verschiedener Talente und Ideen spielt eine entscheidende Rolle für den geschäftlichen Erfolg der Deutschen Bank.

Unsere Unternehmenskultur setzt hohe ethische Standards und fördert ein gutes Miteinander. Unabhängig von kulturellem Hintergrund, Nationalität, ethnischer Zugehörigkeit, geschlechtlicher und sexueller Identität, körperlichen Fähigkeiten, Religion und Generation freuen wir uns über Bewerbungen talentierter Menschen.
Sprechen Sie uns an: Wir bieten flexible Arbeitszeitmodelle und weitere Zusatzleistungen, um Sie in Ihrem Berufsleben zu unterstützen.

Klicken Sie hier für weitere Informationen zu Vielfalt und Teilhabe in der Deutschen Bank.",27Dec2021-11:28:21
job_93df2a750c887916,"Data Analyst - International Trainee Program Talents@DB Schenker (f/m/d)
- job post",DB Schenker,,,"At DB Schenker, you are part of a global logistics network that connects the world. A network that allows you to shape your career by encouraging you to contribute and truly make a difference. With more than 76.000 colleagues worldwide, we welcome diversity and thrive on individual backgrounds, perspectives and skills. Together as one team, we are Here to move.

We are looking for you to support us from April 1st, 2022 in our Head Office in Essen, Germany.

Your tasks:

As a trainee of Global Steering and Master Data Management you will get the chance to understand master data management in a global group and learn how financial steering capabilities in our group are enhanced
Participate in our projects and take over responsibility for small projects, e.g. development of new data analytics approaches
Several (inter-)national deployments during the trainee program will give you the opportunity to get insights into our logistics processes and methods
You will support our change to a data driven steering approach e.g. by preparing and conducting trainings
Establish a line organization for master data management

Your profile:

Good to very good university degree in economics, data science/analytics
First work experience e.g. student internships and/or past employment is a plus
Proficient knowledge of English and German, a further language is an advantage
Good social skills and intercultural competence (e.g. through studies, internships abroad)
Enterprising mindset and proactive approach to business
Excellent analytical and strategic thinking
Well-developed communication skills and high level of customer and service orientation
Experience with SAP, Business Warehouses, RStudio or other statistic programs
Benefits:
Mit Seminaren, Trainings und Qualifizierungen bieten wir unseren Mitarbeitern (m/w/d) individuelle und langfristige Entwicklungs- und Aufstiegschancen auf Fach-, Projekt- oder Führungsebene.
Unsere Nachwuchskräfte werden darin bestärkt, ihr Netzwerk zu pflegen und zu erweitern. So bietet sich jederzeit die Gelegenheit für fachlichen und persönlichen Austausch mit anderen Kollegen (m/w/d).
Wir übernehmen soziale Verantwortung für unsere Mitarbeiter (m/w/d). Dazu gibt es bei DB Schenker ein umfassendes betriebliches Gesundheitsmanagement mit Programmen zur Gesundheitsförderung und Vorbeugung.
Chancengleichheit und selbstbestimmte Teilhabe Schwerbehinderter und Gleichgestellter sowie eine respektvolle Zusammenarbeit sind innerhalb des DB Konzerns fest verankerte Grundsätze. Deshalb werden schwerbehinderte Bewerber bei gleicher Eignung bei bevorzugt berücksichtigt.",27Dec2021-11:28:26
job_d869ecd5fac285cc,"Data Visualisation Analyst (m/f/d)
- job post",Sky Deutschland Fernsehen GmbH & Co. KG,,,"Want to do the best work of your life? With 24 million customers in 6 countries, make your mark at Europe`s leading media and entertainment brand. A workplace where you can proudly be yourself; our people make Sky a truly exciting and inclusive place to work.
“Our state-of-the-art visualisations tell the stories which enable unlocking the power of data at Sky so that we can bring our customers more of what they love.” – Nadine Effenberger, Head of Data Visualisation
What you’ll do
Your job is to deliver innovative visualisation solutions that will meet the business requirements of our partners enabling them to view, explore and understand data
Creating reports and dashboards can't dampen your motivation
As a communicative interface, you'll collaborate extensively with peers across the Data teams and provide technical & domain input to ensure that we collectively understand and strive to solve key business questions
You'll contribute towards defining Visualisation best practice and standards, ensuring consistency of delivery across the team
You'll produce a detailed breakdown of development tasks on projects
Adhere to the end to end change process and apply vital rigour in a timely manner is part of your daily business
You'll take care of consulting and supporting our business users with any data visualisation related topics
You're responsible for operating and administrating the frontend platforms
You'll assist with the mentoring of associate engineers and colleagues during the project lifecycle with a focus on continuous improvement in an encouraging environment
What you’ll bring
You've a degree in Information Technology as well as several years of professional experience
The ability to translate complex business needs into technical requirements sets you apart
You'll bring an extensive data analysis and interpretation background ¿ to critically evaluate data gathered from various sources, helping key partners understand and maximise the potential of Sky's data
Excellent SQL and Big Query skills enabling also complex data visualisation as well as experience in standard reporting tools such as SAP Business Objects are among your strengths
Solid technical background in visualisation tools, such as Tableau, with a focus and understanding of end to end best practice in providing self-serve data and dashboarding capability distinguishes you
Exceptional communication and social skills as well as a demonstrable ability to influence technical decisions in a fast-paced commercial environment characterize you
Good English skills as well as communication and social skills round off your profile
Our benefits:

At Sky, we'll give you our full support, so you'll be all set to achieve your best. Our range of rewards really are something special, here are just a few:
Free Sky Q
Flexible working
Company pension scheme
Sky Company Bike


Inclusion:

We're proud to be an equal opportunity employer.

It is important to us to provide a fair and equal workplace for everyone. We strongly believe that a culture of diversity allows us to grow together and encourages creativity and innovation. Therefore, we will consider all qualified applications – regardless of gender, nationality, ethnic and social origin, religion/belief, disability, age, sexual orientation and identity.

Why wait?

Apply now to build an amazing career and be part of a brilliant team. We can't wait to hear from you.

To find out more about working with us, search #WirbeiSky or #LifeatSky on social media.

A job you love to talk about.
Sky Deutschland GmbH
People & Organisation
Your Contact: Vanessa Bauer",27Dec2021-11:28:31
job_899736abf61bd3b4,"Data Visualisation Analyst (m/f/d)
- job post",Sky Deutschland Fernsehen GmbH & Co. KG,,,"Want to do the best work of your life? With 24 million customers in 6 countries, make your mark at Europe`s leading media and entertainment brand. A workplace where you can proudly be yourself; our people make Sky a truly exciting and inclusive place to work.
“Our state-of-the-art visualisations tell the stories which enable unlocking the power of data at Sky so that we can bring our customers more of what they love.” – Nadine Effenberger, Head of Data Visualisation
What you’ll do
Your job is to deliver innovative visualisation solutions that will meet the business requirements of our partners enabling them to view, explore and understand data
Creating reports and dashboards can't dampen your motivation
As a communicative interface, you'll collaborate extensively with peers across the Data teams and provide technical & domain input to ensure that we collectively understand and strive to solve key business questions
You'll contribute towards defining Visualisation best practice and standards, ensuring consistency of delivery across the team
You'll produce a detailed breakdown of development tasks on projects
Adhere to the end to end change process and apply vital rigour in a timely manner is part of your daily business
You'll take care of consulting and supporting our business users with any data visualisation related topics
You're responsible for operating and administrating the frontend platforms
You'll assist with the mentoring of associate engineers and colleagues during the project lifecycle with a focus on continuous improvement in an encouraging environment
What you’ll bring
You've a degree in Information Technology as well as several years of professional experience
The ability to translate complex business needs into technical requirements sets you apart
You'll bring an extensive data analysis and interpretation background ¿ to critically evaluate data gathered from various sources, helping key partners understand and maximise the potential of Sky's data
Excellent SQL and Big Query skills enabling also complex data visualisation as well as experience in standard reporting tools such as SAP Business Objects are among your strengths
Solid technical background in visualisation tools, such as Tableau, with a focus and understanding of end to end best practice in providing self-serve data and dashboarding capability distinguishes you
Exceptional communication and social skills as well as a demonstrable ability to influence technical decisions in a fast-paced commercial environment characterize you
Good English skills as well as communication and social skills round off your profile
Our benefits:

At Sky, we'll give you our full support, so you'll be all set to achieve your best. Our range of rewards really are something special, here are just a few:
Free Sky Q
Flexible working
Company pension scheme
Sky Company Bike


Inclusion:

We're proud to be an equal opportunity employer.

It is important to us to provide a fair and equal workplace for everyone. We strongly believe that a culture of diversity allows us to grow together and encourages creativity and innovation. Therefore, we will consider all qualified applications – regardless of gender, nationality, ethnic and social origin, religion/belief, disability, age, sexual orientation and identity.

Why wait?

Apply now to build an amazing career and be part of a brilliant team. We can't wait to hear from you.

To find out more about working with us, search #WirbeiSky or #LifeatSky on social media.

A job you love to talk about.
Sky Deutschland GmbH
People & Organisation
Your Contact: Vanessa Bauer",27Dec2021-11:28:37
job_15df0cc1a8dd8b3f,"OTC Data Analyst (w/m/d)
- job post",Siemens Healthineers,,,"Wollen Sie die Zukunft des Gesundheitswesens mitgestalten? Wir bei Siemens Healthineers setzen auf Menschen, die ihre Energie und Leidenschaft diesem Ziel widmen – das sagt schon unser Unternehmensname. Siemens Healthineers steht für Pioniergeist unserer Mitarbeitenden, gepaart mit unserer langen Tradition als weltweit führender Technologiekonzern in der stets dynamischen Gesundheitsbranche.
Wir bieten ein flexibles und dynamisches Umfeld voller Gelegenheiten, über sich hinaus zu wachsen, um sich persönlich und beruflich weiterzuentwickeln. Klingt das interessant für Sie?

Dann werden Sie Teil unseres globalen Teams als OTC Data Analyst (w/m/d), um Siemens Healthineers im Bereich Digitalisierung voranzubringen.

Ihre Aufgaben und Verantwortlichkeiten:
Sie beraten und unterstützen in einem globalen Umfeld die Zonen und Länder während des gesamten Order to Cash (OTC)-Lebenszyklus, von der Bedarfsermittlung über die Implementierung von Lösungen bis hin zur Überwachung der erzielten Ergebnisse
Sie übernehmen die Durchführung von Workshops mit allen beteiligten Stakeholdern, um den Bedarf an Prozessverbesserungen zu erfassen und die Ziele der Kunden in wirkungsvolle Anwendungsfälle zu übersetzen
Sie verstehen End-to-End Prozesslandkarten und können daraus entsprechende Aktivitäten und Aufgaben mit ihrer Darstellung in Unternehmensanwendungen und -systemen ableiten
Sie führen Prozess- und Task-Mining-Analysen durch und erstellen Dashboards, um die datengestützte Entscheidungsfindung und das Leistungsmanagement zu unterstützen
Sie nutzen Ihre bisherigen Erfahrungen in der Daten- oder Geschäftsprozessberatung, um interne und externe Stakeholder erfolgreich zu managen und als Application Owner in Datenprojekten zu agieren
Sie arbeiten gemeinsam mit den IT-Teams und unserem Technologiepartner Celonis an der Auswahl geeigneter Lösungen und der Umsetzung von Maßnahmen zur Wertrealisierung
Sie präsentieren die Ergebnisse vor Stakeholdern aus dem Senior Management
Mehr über dieses Geschäftsfeld erfahren Sie unter https://www.siemens-healthineers.com/de/products-services
Ihre Qualifikationen und Erfahrung:
Sie verfügen über ein abgeschlossenes Masterstudium in (Wirtschafts-)Informatik oder einer vergleichbaren Fachrichtung
Sie haben mehrjährige Berufserfahrung im IT-Consulting oder in der Implementierung von Data Mining oder Process Mining Lösungen (z.B. Celonis)
Wir freuen uns auch über Bewerbende mit Bachelor-Abschluss in Verbindung mit zusätzlicher Berufserfahrung in diesem Bereich
Sie haben fundierte Kenntnisse im Bereich SAP-Systemen und Datenmodellen
Sie haben nachgewiesene Erfahrung bei der Implementierung von Lösungen auf Unternehmensebene und Business Intelligence-Anwendungen, einschließlich ETL
Kenntnisse und Erfahrungen in Programmiersprachen, vorzugsweise SQL und Python, sind wünschenswert
Sie sind ergebnisorientiert und verfügen über ausgeprägtes analytisches Denken, insbesondere im Hinblick auf die Identifizierung von Wertpotenzialen und den Business-Technology-Fit

Ihr Profil und Ihre Fähigkeiten:
Sie verfügen über gute Kommunikationsfähigkeiten sowie exzellente Englischkenntnisse, die es Ihnen ermöglichen mit unterschiedlichen Geschäftsbereichen, Kulturen und Führungsebenen in einem internationalen Umfeld problemlos und auf Augenhöhe zu kommunizieren. Deutschkenntnisse sind von Vorteil
Ihre ergebnisorientierte Arbeitsweise zeichnet Sie aus
Sie haben eine hohe Flexibilität bei der Anpassung an ein sich schnell veränderndes technologisches und organisatorisches Umfeld
Durch Ihr fortschrittliches Denken und Streben nach kontinuierlicher Prozessverbesserung leisten Sie einen Beitrag, unser Unternehmen besser zu machen
Sie arbeiten gerne im Team, mögen es aber gleichermaßen eigenmotiviert und selbständig an unseren gemeinsamen Zielen zu arbeiten. Ihre hohe Einsatzbereitschaft und Eigeninitiative helfen Ihnen beim Erreichen dieser Ziele

Unser globales Team:
Siemens Healthineers ist ein weltweit führendes Medizintechnikunternehmen. Mit mehr als 66.000 engagierten Mitarbeitenden in über 70 Ländern gestalten wir die Zukunft des Gesundheitswesens. Jeden Tag profitieren etwa fünf Millionen Patient*innen weltweit von unseren innovativen Technologien und Dienstleistungen aus den Bereichen Diagnostik und therapeutische Bildgebung, Labordiagnostik und molekulare Medizin sowie von unseren digitalen Gesundheits- und Unternehmensdienstleistungen.

Unsere Kultur:
Unsere Unternehmenskultur schätzt verschiedene Blickwinkel, offene Diskussionen und den Willen, Konventionen in Frage zu stellen. Ständiger Wandel gehört zu unserem Arbeitsalltag. Wir wollen in unserer Branche Veränderungen vorantreiben, statt nur darauf zu reagieren. Deswegen laden wir Sie ein, sich neuen Herausforderungen zu stellen, eigene Ideen auszutesten und Erfolge zu feiern.Besuchen Sie auch unsere Karriere-Seite unter https://www.siemens-healthineers.com/de/careers
Wir legen Wert auf Diversität und Chancengleichheit und freuen uns über Bewerbungen mit vielfältigen Hintergründen und insbesondere von Menschen mit Behinderung.

Sie möchten mehr erfahren und erste Fragen gern persönlich klären – Sprechen Sie uns an: +49 (9131) / 17 – 1717. Kontaktperson dieser Stellenausschreibung ist Barbara Höhne.

Wir nehmen den Schutz Ihrer Daten und die Einhaltung der DSGVO und anderer Datenschutzgesetze ernst. Deshalb bitten wir Sie, uns Ihren Lebenslauf nicht per E-Mail zu schicken. Bitte legen Sie ein Profil in unserer Talent Community an, um Ihren Lebenslauf hochzuladen. Daran erkennen wir, dass Sie an Karrieremöglichkeiten bei uns interessiert sind und können Sie zu relevanten Stellen benachrichtigen. Klicken Sie hier, um ein Profil anzulegen.

Siemens Healthineers Deutschland wurde mit dem Zertifikat Great Place to Work® ausgezeichnet.

Organisation: Siemens Healthineers
Unternehmen: Siemens Healthcare GmbH
Erfahrungsniveau: Professional
Jobtyp: Vollzeit",27Dec2021-11:28:42
