0,1,2,3,4,5,6
job_9f28028768e374d2,"Junior Data Scientist (f/m/div)
- job post",Penta,,,"About your new role:
Our mission is to Invent Better Business Banking, and our Junior Data Scientist helps us to do this by working with your colleagues to apply data science concepts to the automation, augmentation, and optimization of Penta's product portfolio.
The Junior Data Scientist is part of our Data team, which is in our Product function. You'll have the opportunity to join our brand-new data science team. As a professional in the early stage of your career, this will be a great opportunity to learn and develop while working with more experienced data scientists who can help mentor you. You will have real responsibilities from the beginning and will be able to work on a wide range of interesting projects.
In your new role, you will:
Work with other team members on building machine learning models
Work with analysts to apply DS concepts to our analytical work
Run your own smaller projects
Contribute code to our internal libraries
Act as a contact point for stakeholders
What you need to be successful:
Graduates with a very good university degree in (business) mathematics, physics or statistics/data science, or a comparable course of study. If you've already worked as a working student or intern in a data science capacity, that's a bonus
A good baseline understanding of statistical concepts
Practical experience of statistics, mathematical modeling, and the advantages and disadvantages of common machine learning techniques
You have knowledge of R and/or Python and have some exposure to the most common packages for common libraries for data analysis and visualization. SQL would be a bonus.
A desire to learn quickly and try new things
What's in it for you:
The opportunity to change the way banking works for SMEs, startups, and freelancers.
A virtual stock option program for all Pentonians, allowing you to benefit from Penta's future growth.
Company-wide events — we believe that hard work and success deserve to be celebrated both inside and outside our office.
Importance of celebrating every success (really everyone).
Working with a diverse and talented group of colleagues. (they really are)
A high level of collaboration and autonomy.
A cross-site wellness program: flexible work hours (hybrid model), yoga, Nilo consulting opportunities, and more.
A strong network of companies and experts as part of the finleap family, Europe's #1 fintech ecosystem.
High sense of sustainability.
Strong awareness of the continuous development of employees with the 70:20:10 model and providing access to learning content at all times through a learning platform
Choice of Laptop (Lenovo or MacBook)
Free public transport
28 days of vacation + 1 extra day for religious holidays.
The opportunity to travel between our offices.
Offices in the hottest parts of the city offering cold drinks, brain food, and sweets.
Why Penta?
Penta is on a mission to invent better business banking for SMEs, entrepreneurs & freelancers and provide them with the experience they deserve when it comes to handling their finances with ease and transparency. We are trusted by more than 40,000 clients, and we are on a path to grow even more.
We are a growing team of professionals striving towards the same goal; making Penta's product the best. When we see our customers happy, it motivates us even more to push traditional boundaries and inspires us to reimagine business banking for good. Penta has international offices in Berlin and Belgrade.
Sounds good? Then we'd love to get to know you!
""Penta embraces diversity and equal opportunity in a serious way. We don't just accept difference, we thrive from it, and it's the basis of our success. We are committed to building a team that represents a variety of backgrounds, perspectives, and skills. The more inclusive we are, the better our work will be.""",27Dec2021-11:29:19
job_f21f69d7155f9991,"Data Analyst - Seller Platform (f/m/d)
- job post","real,- Digital Payment & Technology Services GmbH",,,"Who we are

We are part of the team behind kaufland. de: Several thousand merchants and millions of products make our multi-channel portal one of the largest marketplaces in Germany. Our work is characterised by a dynamic corporate culture, with a start-up mentality and the opportunities offered by a large corporation in the background. We combine knowledge and many years of experience in e-commerce with flat hierarchies and a highly motivated team. Whether as an intern or an executive: We take every idea seriously, because we want to work together in shaping the future of e-commerce!

We love flexibility ! That's why we offer you a modern workplace in our office in Cologne / Darmstadt / Düsseldorf, while at the same time giving you the opportunity to work on a mobile basis in consultation with your manager. We want to offer you the most attractive workplace in e-commerce and a maximum of flexibility for your personal work-life balance.

Day-by-day, our development team of about 190 experts pursues the goal of creating the best-possible customer shopping experience for the Kaufland. de marketplace. We are here to inspire millions of customers, to help them find, purchase and get the things they love. To enrich the lives of our customers, we collaborate in cross-functional teams, in which product owners, product designers, frontend and backend engineers, data scientists and lean managers join forces. Details regarding the challenges of the respective product areas can be found here: https://www.real-digital.de/team/tech/.

Tasks

Your tasks – this is what awaits you in detail

You take over the role of a proactive and strategic analyst across the Seller Area and journey (seller inventory, seller delivery, seller management)
You have a focus on seller-related data, processes to improve the product and seller experience
You invest time to understand our business, derive ideas for optimization and business development, and help make product initiatives measurable
You evaluate strategic directions and identify business opportunities -- always quantifying your ideas
You support the standardization of business intelligence processes and the design of self-service and silver-service solutions for your stakeholders
You showcase and promote best practices related to analysis and visualizations internally
Requirements

Your profile – this is what we expect from you

You have a university degree in business informatics or a comparable course of study such as statistics, mathematics, or business administration
You have a very high capacity for abstraction and a well-founded understanding of algorithms, business processes, as well as an affinity for working with data
You are experienced in data modelling, data analysis, and visualization methods
You have good to very good knowledge of SQL (experience with BigQuery is a plus) and visualization software (ideally Tableau)
You possess excellent problem-solving abilities, attention to detail, and distinct analytical skills combined with an entrepreneurial mindset
You speak English fluently
Benefits

What we offer

Modern workplaces in our office and at the same time the possibility to work mobile in agreement with your manager
A highly-motivated and qualified team from different fields and numerous nations
A sophisticated product with millions of users and a broadly-based technology stack
A dynamic environment with a start-up mentality, no superfluous red tape and hierarchy, as well as plenty of courage and trust to break new ground
Free choice of hardware – we provide you with the development environment of your choice
Always up-to-date – you receive four days of special leave and a budget of €1,300 per year to attend relevant fairs and conferences
Top conditions at the Urban Sports Club for fitness, team sports, yoga and more
Why are you the perfect fit for this position? Don't bother with cover letters - we're interested in facts and figures!

As we have very international teams, we would highly appreciate it to receive your CV or profile link in English.

You would rather like to work part-time? No problem for us - let’s figure out the ideal work-life balance together!",27Dec2021-11:29:25
job_73d308f27c2deb32,"Working Student (f/m/d) Data Analyst
- job post",W. L. Gore & Associates,,,"Tätigkeit
: Geschäftsausführung
Primärer Standort
: Europa-DE-BY-Feldkirchen-Westerham
Reisetätigkeit : None
Schicht
: Frühschicht
Beschäftigungsart
: Teilzeit
Working Student (f/m/d) Data Analyst - 213380
About Us: Gore is a materials science company focused on improving lives through discovery, product innovation and rewarding careers for our Associates.
About the Industry: Gore’s pioneering contributions to the science of comfort and protection create fabrics for a range of activities and conditions. Learn more at gore.com/products/industries
About the Role: We are looking for a Working Student (f/m/d) to support our Business Process and Data Management Team starting from 01.03.2022 at our plant in Feldkirchen-Westerham or Putzbrunn near Munich. In close collaboration with your colleagues you work on data mining, profiling and analyzing of data to enable fact driven decision making.
For this position you are available for 1 ½ - 2 days per week for 6 months or ideally longer.
Responsibilities:
Explore data independently and run quality checks
Access data from various systems and combine it together into dedicated datamarts and verify data
Perform various ad hoc analyses, and perform quality, completeness and accuracy of data definitions, including cleansing of data
Work proactively on the optimization of the existing data structure collection in order to analyze the performance of our product distribution
Deliver meaningful insights which help enhance sales business performance
Design data quality monitors to meet data needs
Qualifications:
Hands on experience in SQL programming and either R and/or Python
Familiar with data visualization tools such as Tableau, Power BI or similar and sales CRM tools, such as Salesforce
You speak fluent English and good German and like working in an international team
You are very hands-on and able to “crunch the numbers”
You are passionate about using data to drive actionable recommendations
You have a high degree of rigor, organization and discipline to get things done
You are able to communicate effectively in delivering complex data-driven solutions to various stakeholder audiences
Curiosity is your second nature
That's what you've got to look forward to:
The opportunity to join a highly motivated team and a good working atmosphere
An interesting and challenging opportunity with an international focus
A very good compensation
A healthy approach to work-life-balance, free tea and coffee, a subsidized canteen and more
We believe in the strength of a diverse workforce and inclusive work environment. In support of our values and continued success we are proud of Associates around the world who support an inclusive work environment, strive to reflect the diversity of the communities where we operate, and ensure all Associates and external partners are treated with fairness, dignity, and respect. Learn more at gore.com/careers
At Gore we are looking for qualified and motivated individuals. We welcome all applications irrespective of social and cultural background, age, gender, disability, sexual orientation or religious belief.
Our Talent Acquisition Team will be pleased to answer your questions on +49 (0)89 4612 2800 or toll free on +800 4612 2800.
#LI-INT",27Dec2021-11:29:30
