0,1,2,3,4,5,6
job_33046cf5a6428466,"Junior Data Scientist / Data Analyst (m/w/d)
- job post",MEWA Textil-Service,,,"Wir suchen in Wiesbaden einen
Junior Data Scientist / Data Analyst (m/w/d)


MEWA ist ein wertorientiertes Familienunternehmen und als Dienstleister für das moderne Textil-Management führend in Europa. Unseren Erfolg verdanken wir unseren rund 5.700 Mitarbeitern. Wir wachsen beständig aus eigener Kraft. Deshalb können wir sichere und perspektivenreiche Arbeitsplätze bieten. Wir sind Chancengeber für Mitmacher, die gemeinsam mit uns mehr erreichen wollen bei einem Weltmarktführer mit Tradition. MENSCHEN. WERTE. MEWA.
Herausforderungen für Mitmacher:
Sie gestalten maßgeblich den Aufbau von Data Science in unserem Geschäftsbereich Marketing und Vertrieb.
Ihre Aufgabenschwerpunkte liegen in den Bereichen Data Mining, Operationalisierung von analytischen Modellen und der Konzeption neuer Data Science Use Cases.
Sie analysieren und optimieren den Erfolg von Maßnahmen und entwickeln Methoden, mit denen vorausschauend gesteuert werden kann.
In enger Zusammenarbeit mit unseren Business Partnern kreieren Sie neue Anwendungsfälle für analytische Modelle und erarbeiten Datenanalysen.
Sie stellen sicher, dass die Erfolgsmessung der eingesetzten Algorithmen in die bestehenden Reporting-Landschaften integriert werden.
Ad-hoc-Analysen zur Unterstützung verschiedener Business Partner sowie die Ableitung von Hand-lungsempfehlungen führen Sie ebenfalls gekonnt durch.
Das Besondere an Ihnen:
Sie können ein abgeschlossenes Informatik-, Mathematik- oder anderes naturwissenschaftliches Studium bzw. vergleichbare Kenntnisse vorweisen. Dank Ihrer ersten Praxis in der Entwicklung und Operationalisierung von Data-Science-Methoden, idealerweise im CRM-Umfeld, sind Sie perfekt aufgestellt.
Ihre Sensitivität für Zahlen und Daten sowie Ihr versiertes Verständnis für operative Geschäfts-prozesse haben Sie schon mal unter Beweis gestellt, Analyseergebnisse können Sie leicht verständlich aufbereiten und kommunizieren.
Mit Data Science, Customer Intelligence und Predictive Modeling haben Sie bereits Erfahrung und Sie beherrschen eine Programmiersprache aus dem Data-Science-Umfeld (bevorzugt Python, R oder SAS)
Idealerweise hatten Sie schon Berührungspunkte mit der analytischen Datenmodellierung und -aufbereitung und kennen technischen Infrastrukturen.
Ihren strukturierten und analytischen Arbeitsstil kombinieren Sie mit leidenschaftlichem Engagement zum Aufbau von Data Science – und sind ein wahrer Teamplayer.
Familienunternehmen
Auf Dauer angelegter, sicherer Arbeitsplatz


Karrierechancen
Intensive Einarbeitung und Weiterentwicklung


Job Ticket
Job Ticket für den öffentlichen Nahverkehr


Job Rad
Job Rad inkl. Arbeitgeberzuschuss


Flexible Arbeitszeiten
Vereinbarkeit von Familie und Beruf und mobiles Arbeiten


Zusatzleistungen
Zuschuss zu vermögenswirksamen Leistungen

Mitarbeiterrabatte
Ein breites Angebot an Mitarbeitervergünstigungen

Ihr Weg zu uns:
MEWA AG & Co. Vertrieb OHG
Frau Xuyan Feng
Tel.: +49 611 7601-360",27Dec2021-11:28:48
job_e6f6f00bc49f3df6,"Data Analyst - Edtech (f/m/d)
- job post",CareerFoundry GmbH,,Vollzeit,"Data Analyst - Edtech (f/m/d)
Job description
Overview

CareerFoundry is building the most human-centric online education experience for career changers in tech. We are a startup with nationalities from over 30 countries who value learning, growing, and working in an integrative, collaborative, and transparent environment.

This is a full-time position based in Berlin, Germany. We are a remote-first company but will still have regularly occurring in-person meetings when the health situation allows.

We’re looking for a curious and experienced data analyst to help us translate complex user data, both quantitative and qualitative, into usable insights for teams across the organization.

What you’ll work on:
1. Research

Lead requirements gathering, planning, and development efforts for data projects throughout the organization involving marketing, student, and mentor data
Work with stakeholders to understand their information needs and ensure that the solutions provided will be flexible as needs change
Assist stakeholders with ad hoc analyses and design and build automated dashboards and other reports that will help stakeholders make effective decisions
Conduct exploratory research to identify potential issues or areas for improvement
2. Communication

Clearly present insights and findings to both technical and non-technical colleagues
Serve as a contact point for information regarding our data and translate between technical and non-technical colleagues
Prioritize incoming requests for data from different stakeholders around the organization according to need and business value
3. Data strategy

Assist with the creation of metrics such as OKRs and create short- and long-term approaches to monitor this data
Provide insights and actionable insights regarding financial data to help us achieve our financial targets
Identify issues with data quality and work with engineering to plan approaches to resolve these issues
Work with engineering to filter, organize, standardize, and clean our existing data
Coordinate with our engineering team on deliverables and collaborate on data strategy for the organization
Job requirements
Your background:

BA/BSc in a quantitative field such as Statistics, Mathematics, and Economics preferred OR relevant work experience
3-4 years’ experience as a data analyst
Strong SQL skills with experience in querying complex data sets
Good analytical and problem-solving skills and attention to detail
Comfortable working with complex and ambiguous problems
Desire to collaborate closely with others skills and ability to communicate complex concepts clearly to a variety of stakeholders at different levels of the organization
Ability to manage projects and timelines independently and accurately scope work
Comfortable communicating in English, our working language

Preferred:

Experience working with BigQuery
Experience with data visualization frameworks like Google Data Studio or SuperSet
Experience with Python scripting
Experience with agile, scrum, and other project management methodologies
Experience working with goal-setting frameworks like OKRs
Advanced knowledge in statistical tools and financial analysis

The CareerFoundry Culture:
Working on a product that has a real positive effect on the world by helping thousands of people change their lives through education
We’re a purpose and value driven organization, read more about our culture here.
A lot of autonomy and freedom in making decisions and leading initiatives
A supportive, open-minded and friendly team environment, with regular team events
Development reviews every 6 months and regular professional development check-ins

Our Benefits:

Competitive salary, equity shares and opportunities to grow your skills on the job
We’re remote first and offer flexible working times and 30-days holidays/year
A generous yearly education budget for each employee to learn new skills
Visa sponsorship and relocation support if needed
An optional company retirement insurance plan
Free access to the CareerFoundry courses
Dog-friendly office and as much coffee (or tea!) as you need
A fully covered Urban Sports Club Membership

CareerFoundry is committed to an inclusive workforce that fully represents many different cultures, backgrounds and viewpoints. The more diversity we have in our team, the more unique perspectives and bright ideas we share.

All applicants will be considered for employment regardless of race, color, religion, sex, sexual orientation, gender identity, national origin, age, veteran or disability status. We actively encourage applicants who self-identify as a member of any of these groups to apply!

Apply for this job
Apply for this job Apply with Indeed
Share this job opening
Linkedin
Facebook
Twitter",27Dec2021-11:28:53
job_4a411d003080555b,"FX Sales – Analyst / Associate (Frankfurt)
- job post",Morgan Stanley,,,"FX Sales – Analyst / Associate (Frankfurt)
Job Number:
3195558
POSTING DATE: Dec 16, 2021
PRIMARY LOCATION: Europe, Middle East, Africa-Germany-Germany-Frankfurt
JOB: Investment Banking/Sales/Trading/Research
EMPLOYMENT TYPE: Full Time
JOB LEVEL: Associate
DESCRIPTION
3195558 - FX Sales – Analyst / Associate (Frankfurt)


Company Profile:


Morgan Stanley is a leading global financial services firm providing a wide range of investment banking, securities, investment management and wealth management services. The Firm's employees serve clients worldwide including corporations, governments, and individuals from more than 1,200 offices in 43 countries.

As a market leader, the talent and passion of our people is critical to our success. Together, we share a common set of values rooted in integrity, excellence, and strong team ethic. Morgan Stanley can provide a superior foundation for building a professional career - a place for people to learn, to achieve and grow. A philosophy that balances personal lifestyles, perspectives and needs is an important part of our culture.
Department Overview:


The Fixed Income Division is comprised of Interest Rate and Currency Products, Credit Products and Distribution. Professionals in the Division assess and actively manages risk, trade securities, and structure as well as execute innovative transactions in the fast-paced and constantly changing global markets. The Commodities Division is a market leader in energy, metals, and agricultural product trading worldwide whose professional’s trade in both physical and derivative commodity risk.
The Financial Institution FX sales team is looking for an Analyst to join the team in Frankfurt. They will be involved in originating and structuring FX and other Derivative solutions for EMEA clients focusing primarily in Germany, Austria, and Switzerland.
QUALIFICATIONS
Primary Responsibilities:


Working with Morgan Stanley’s Investment Banking clients, with a focus on EMEA Financial Institutions, to deliver FX Derivative Solutions to manage short-and-long term risk around ongoing business exposures
Pricing and executing a range of products across the Foreign Exchange asset class (including G10 and EM spot, forward, and options)
Responsible for the day to day running of transactions from start to finish, liaising with key internal stakeholders across Investment Banking, Capital Markets, Sales & Trading, Credit and Legal throughout
Preparing client presentations and materials (including trade ideas) for a wider audience within the Firm and the financial services industry


Skills required:


Fluency in German preferable
Experience interacting directly with external corporate or institutional clients
Pricing and execution experience of Financial Markets products
Keen interest in financial markets
A positive, motivated, can-do attitude and desire to work in a highly team-oriented environment
Strong oral and written communication skills
You have strong analytical and numerical skills that put you at ease with financial data
You are results-driven, perform well under pressure and against tight deadlines
You articulate complex ideas simply and summarize them effectively
You are committed to excellence in your work and maintain high professional and ethical standards

Morgan Stanley is an equal opportunities employer. We work to provide a supportive and inclusive environment where all individuals can maximise their full potential. Our skilled and creative workforce is comprised of individuals drawn from a broad cross section of the global communities in which we operate and who reflect a variety of backgrounds, talents, perspectives and experiences. Our strong commitment to a culture of inclusion is evident through our constant focus on recruiting, developing, and advancing individuals based on their skills and talents.

Interested in flexible working opportunities? Morgan Stanley empowers employees to have greater freedom of choice through flexible working arrangements. Speak to our recruitment team to find out more.
Given the continued spread of COVID-19 (coronavirus), all interviews will be conducted by phone or virtual connection to protect our candidates and employees.",27Dec2021-11:28:58
sj_f1d3ece3570f6d11,"Data Analyst (m/w/d)
- job post",L'Oreal,,,"Warum L’Oréal?
Uns treibt die Leidenschaft für Schönheit, die die Welt bewegt.
Wir sind Marktführer in Beauty und Pionier im Bereich Beauty Tech. Als Folge der sich konstant verändernden Welt, sind für uns Kosmetik und Technologie untrennbar miteinander verbunden. Gemeinsam mit unseren Konsumenten und Partnern antizipieren wir Trends und gestalten Schönheit von Morgen.
Wir leben Nachhaltigkeit und Umweltschutz. Unsere Verpflichtungen bis 2030 markieren den Beginn eines radikaleren Wandels und verkörpern unsere Auffassung darüber, wie die Vision, der Zweck und die Verantwortung eines Unternehmens aussehen sollten, um den Herausforderungen der Welt zu begegnen. Unsere 88.000 Mitarbeiter in 150 Ländern transformieren unser Business, um sicherzustellen, dass unsere Aktivitäten die Grenzen unseres Planeten respektieren.
Wir suchen Mitarbeiter, die gemeinsam mit uns einen Unterschied machen wollen.
Ihre Aufgaben
Als Data Analyst in unserem zentralen Data & Analytics Team unterstützen Sie uns auf dem Weg zu einer datengetriebenen Organisation.
Ihre Aufgaben umfassen:
Eigenständige Analyse und Auswertung unternehmensweiter Daten aus internen und externen Quellen im Bereich e-commerce / CRM mit Fokus auf B2B
Basierend auf Daten und analytischen Erkenntnissen Unterstützung unserer Fachbereiche bei der Ableitung von Best Practices und Erarbeitung geeigneter Strategien mit dem Ziel das Kunden-/Kanalwachstum voranzutreiben
Regelmäßige und ad-hoc-Analyse von online Marketing- und CRM-Kampagnen (z.B. ROI-Analysen)
Durchführung von Analysen auf Kundenebene bzw. entlang des Kundenlebenszyklus (z.B. CLV Analysen, Kundensegmentierung)
Unterstützung bei der Entwicklung von Attributionsmodellen zwecks effizienter Steuerung der Marketingkanäle und der optimalen Budgetallokation
Pflege, Auswahl, Bereinigung und Reduktion/Transformation von strukturierten und unstrukturierten Daten
Erstellung und Weiterentwicklung moderner Reports und Visualisierungen für Monitoring, Benchmarking und Analyse von e-commerce / CRM Daten
Mitarbeit an fachbereichsspezifischen sowie organisationsweiten e-commerce / CRM- und Daten-Projekten

Ihr Profil
Erfolgreich abgeschlossenes Studium im Bereich Wirtschaftswissenschaften, Wirtschaftsinformatik, e-commerce oder vergleichbar
Mindestens zwei Jahre Berufserfahrung als Business / Data Analyst, vorzugsweise im Bereich Digital / e-commerce
Praktische Erfahrungen mit Business Intelligence Systemen (z.B. Microsoft BI Stack) und Analyseplattformen (z.B. Google Analytics, Adobe Analytics)
Gute Kenntnisse in der Visualisierung mit Power BI, Looker oder vergleichbar
Ausgeprägtes analytisches Denkvermögen sowie die Fähigkeit analytische Erkenntnisse und Handlungsempfehlungen zu erarbeiten und zielgruppengerecht zu vermitteln
Basiskenntnisse einer Programmierungssprache (z.B. Python oder R)
Erfahrungen im Umgang mit Datenbanken / abfragen, idealerweise mit PowerQuery, BigQuery, Microsoft SQL ist ein Plus
Sichere Deutsch- und Englischkenntnisse
Hohes Maß an Kundenorientierung, Eigenständigkeit, Leistungsbereitschaft sowie Hands-on-Mentalität
Spaß eigene Ideen voranzutreiben, kontinuierlich zu lernen und eigenes Wissen weiterzugeben
Unser Angebot
Eine unbefristete Arbeitsanstellung in einem krisenresistenten, wachsenden Markt mit einem umfassenden Angebot an Sozialleistungen
Eine attraktive und wettbewerbsorientierte Vergütung sowie ein freiwilliges Profitsharings
Individuelle persönliche und fachliche Weiterentwicklung, eine steile Lernkurve, starker Teamgeist und eine offene, kooperative Unternehmenskultur
Vielfältige, nationale und internationale Perspektiven

Diversity & Inclusion
L'Oréal verpflichtet sich seinen Bewerberinnen und Bewerbern gegenüber zur Chancengleichheit. Wir wissen Diversität, Inklusion und den individuellen Selbstausdruck am Arbeitsplatz wertzuschätzen, da Vielfalt unsere Teams stärkt und wir das Bild der Gesellschaft und somit unserer Konsumenten in unserem Unternehmen spiegeln möchten. Jegliche Form von Diskriminierung wird daher nicht toleriert.",27Dec2021-11:29:04
job_fb37c78e1c74a9d6,"Data Analyst - Commercial (m/f/x)
- job post",reBuy reCommerce GmbH,,Vollzeit,"Company Description
We are rebuy and we are looking for you! We are on a mission to make pre-owned consumer electronics and media articles the preferred choice of consumers. Through this mission, we are helping the environment and protecting our planet. At rebuy, our hearts beat green and our team of 550 people is working together to bring high-quality pre-owned products to you!
Job Description:
We are looking for a Data Analyst in the central Data Science & Analytics team, currently consisting of multiple Data Scientists, Data Analysts, and Data Engineers.
This role is not just about doing analysis to answer questions raised by stakeholders. We are looking for someone with an impressive business acumen who can drive data-backed initiatives. Someone who makes sure that data is the loudest voice in a room full of personal opinions. You’ll apply critical thinking, objectivity, and pragmatic data wrangling skills to enable evidence-based decisions, and deliver succinct stories.
This is a high-impact role in a new working environment - you’ll be excited, rather than daunted by that. Able to both influence cross-functional leaders with your compelling insights, and roll your sleeves up to kick start best in class data operations, analysis by analysis.
Key Responsibilities:
Partner with the commercial teams to identify potential improvements in business processes.
Proactively analyze data to answer key questions from stakeholders, come up with actionable insights, and present them in a concise presentation or a dashboard
Create hypotheses to solve business problems and design framework to test and analyze the results
Mine and analyze data from company databases to drive improvement of sales processes (primarily pricing) and business strategies
Take full ownership of projects and be proactive in leading initiatives
What you'll receive in return:
Autonomy
Visibility to present your work
Support from a central Data Science team and coaching from a central functional lead
Exposure to real challenges with big impact
Chance to work with a purpose-driven business, helping the planet
Qualifications:
More than 2 years of experience in analytics, data science, or similar fields
A degree in Statistics, Mathematics, Engineering, or another quantitative field
Proven analytical skills, including mining, evaluation, analysis, and visualization
Agile mindset and strong problem-solving skills with an emphasis on product development
Proficiency in SQL and experience of working with large data sets
Excellent written and verbal communication skills in English
Experience in creating dashboards (we use Looker) is a plus
Location:
Berlin
HO
Remote - must reside in Germany
What to expect at rebuy:
A successful, professional, and dynamic team where autonomy and new ideas are welcomed
Flat hierarchy and transparency
Brand New office in Berlin Kreuzberg just seconds away from the Spree
Family-friendly and flexible environment
Employee Discounts
Corporate Benefits Program
Language Courses (English & German)
Online Yoga and CrossFit Classes
Team and Company Events
Massages and Wellbeing Offers
Mental Health Support
\*At rebuy all people are welcome and supported! We would like to talk, regardless of age, disability, national and social origin, skin color, religion, gender identity and sexual orientation. Just be who you are!
Job Type: Full-time",27Dec2021-11:29:09
sj_6a580c82c71d2d7e,"Pricing Data Analyst (f/m/d)
- job post",Zalando SE,,,"As the Pricing Data Analyst, you will be a dedicated Data Analyst for Pricing platform initiatives at Zalando and contribute to high impact initiatives directly improving the way we set prices on >500K articles for more than 39 million customers in 20 countries. As part of a cross-functional team, you help to maximise impact with our dedicated four-digit million euro annual discount investment. You will build a deep understanding of how pricing decisions during and outside sales events impact our customers’ behaviours, purchase patterns and customer lifetime value. You independently perform analytical tasks and own projects within your team and transform data into actionable insights and recommendations that drive strategic and operative decisions.
You will be part of a broader team of 10 analysts, with learning and mentoring opportunities as well as a larger community of analysts across Zalando.
WHERE YOUR EXPERTISE IS NEEDED
Understand our customers' behavior by developing ad hoc and regular analysis & statistical models on customer and transactional data to support driving optimal pricing decisions and customer value. Share results & visualizations in automated reports.
Deliver and present actionable insights. Identify new strategic opportunities and recommend actions supporting the pricing strategy. Become a trusted advisor to your stakeholders and our senior management.
Formulate easy-to-understand recommendations based on strong analytical insights to get stakeholder buy-in.
Drive data mindset in the team and guide in terms of methodology & technology. Collaborate with other analysts, data scientists, engineers and commercial colleagues to untap new sources of data and know-how.
Foster an inclusive & diverse team environment
WHAT WE’RE LOOKING FOR
2+years of experience in Analytics, answering business questions with model driven statistical analysis.
Very good quantitative degree, e.g. in Economics, Social Science, Statistics, Mathematics, Computer Science or related fields.
Advanced Skills in data methodologies and technologies (SQL + Python). MicroStrategy & Tableau are considered as a plus. Curious about learning new technologies.
PERKS AT WORK
Join a welcoming, diverse team that takes work-life balance and mental health seriously. Part-time contracts are possible, parents of young children are explicitly encouraged to apply.
A workplace run on trust, empowerment and feedback; positive, inspiring working atmosphere
Competitive salary, employee share shop, 40% Zalando shopping discount, discounts from external partners, centrally located offices, public transport discounts, municipality services, great IT equipment, flexible working times, additional holidays and volunteering time off, free beverages and fruits, diverse sports and health offerings
Mentoring and personal development opportunities and an international team of experts
Relocation assistance for internationals, PME family service and parent & child rooms
We celebrate diversity and are committed to building teams that represent a variety of backgrounds, perspectives and skills. All employment is decided on the basis of qualifications, merit and business need.
ABOUT ZALANDO
Zalando is Europe’s leading online platform for fashion, connecting customers, brands and partners across 17 markets. We drive digital solutions for fashion, logistics, advertising and research, bringing head-to-toe fashion to more than 34 million active customers through diverse skill-sets, interests and languages our teams choose to use.
Please note that all applications must be completed using the online form - we do not accept applications via email.",27Dec2021-11:29:14
