0,1,2,3,4,5,6
sj_d891a9f1363cab60,"Data Analyst (m/w/d)
- job post",Visable GmbH,,,"Forme mit uns die Zukunft des B2B
Als Data Analyst identifizierst, analysierst und interpretierst Du Muster und Trends in komplexen Datensätzen
Du arbeitest in cross-funktionalen Teams in verschiedenen Bereichen (z. B. Produkt, Marketing), um Visable zu einer data-driven Company zu formen
Du hilfst mit, unsere ""Single Source of Truth"" zu etablieren und manuelle Prozesse durch cloudbasierte Lösungen zu ersetzen
Du bist Ansprechpartner für Analysefragen und betreust unsere Poweruser unter Verwendung der bereitgestellten Datenquellen
Automatische Berichtsverfahren und Analyse-Dashboards werden von Dir implementiert
Du lieferst proaktiv Inisghts für das Daily Business
Du berätst die Teams hinsichtlich neuer Metriken und KPIs und automatisierten und nachhaltigen Reports
Was wir bieten
Die Möglichkeit, die Zukunft des Online-B2B-Geschäfts zu gestalten und einen European Champion aufzubauen
Ein agiles und unterstützendes Umfeld, in dem Erfolg immer eine Teamleistung ist
Als Teil unseres freundlichen und aufgeschlossenen Teams kannst Du eigene Ideen einbringen und Dich kontinuierlich weiterentwickeln
Wir bieten Dir attraktive Incentives und faire Entlohnung mit modernen Büros
30 Tage Urlaub, flexible Arbeitszeiten und die Möglichkeit, mobil zu arbeiten
Damit beeindruckst Du uns
Abgeschlossenes Studium im Bereich der Mathematik, Statistik, Informatik oder vergleichbar
Gutes Verständnis von Datenprozessen und Business Needs
Sehr gute SQL-Kenntnisse, sicherer Umgang mit transaktionalen Datenbanken und Datenmodellen (Star- und Snowflake-Schema)
Erfahrungen mit Tableau oder anderen Reporting-Tools
Ausgeprägte analytische Fähigkeiten und der obligatorische Blick über den Tellerrand
Eigeninitiative, Teamplayer und Spaß am Umgang mit anderen Menschen sind ein Muss
Verhandlungssicheres Englisch in Wort und Schrift, gute Deutschkenntnisse sind von Vorteil

Hast Du Fragen?
Isabel von Visable hilft Dir bei Fragen zu Deiner Bewerbung weiter.
Wende Dich einfach per E-Mail an uns. recruiting@visable.com",27Dec2021-11:22:07
job_1922d5ecc9522d8c,"Data Analyst im User Lab (m/w/d)
- job post",Innovations- und Digitalagentur (ida),,"Vollzeit, Teilzeit, Festanstellung","Als Innovations- und Digitalagentur lösen wir für unsere Kund: innen komplexe Probleme und finden kreative Lösungen. Während sich bei unserer Arbeit vieles ums Digitale dreht, dreht sich bei uns im Team alles um die Menschen, mit denen wir gemeinsam arbeiten. Denn wir wissen: Gute Arbeit braucht ein gutes Umfeld.
Und was wir auch wissen: Das Leben ist, wie es ist – und Lebensläufe sind nicht immer geradlinig. Das ist auch gut so, denn wir suchen keine CVs, sondern Personen mit Charakter: Die lieben, was sie tun. Die sich trauen, Neues zu probieren. Die auch mal scheitern. Ganz einfach Menschen mit einer unerschütterlichen Leidenschaft für Qualität.
Das erwartet dich bei ida:
Du bist Teil unseres User Labs und baust das Kompetenzfeld datengestützte Beratung aus, indem du Nutzer: innen-Daten von Websites, Apps oder Social-Media-Plattformen analysierst, komplexe Zusammenhänge erkennst und die richtigen Schlüsse daraus ziehst.
Von der Projektanbahnung bis zum Projektabschluss – du stehst unseren Kund: innen kontinuierlich beratend zur Seite.
Du bist für das Projektmanagement deiner Projekte selbst verantwortlich, kommunizierst daher auch zielgerichtet mit unseren Kund: innen, tauschst dich aber auch regelmäßig mit dem Team aus. Better together und so…
Du arbeitest nicht nur mit unseren Kund: innen, sondern auch mit anderen ida-Teams (z.B. SEO, BI, Product oder Audience Development) eng zusammen.
Remote oder Office? Wir können beides, ganz wie du willst.
Du hast die Möglichkeit, u.a. die Angebote der öffentlich-rechtlichen Rundfunkanstalten maßgeblich mitzugestalten und zu verbessern – und kannst so einen positiven Beitrag für unsere Gesellschaft leisten.
Das bringst du mit:
Du verfügst über handfeste Kenntnisse in der Analyse größerer Datenmengen, zum Beispiel mittels statistischer Methoden.
Wenn wir uns was wünschen dürften, dann hast du bereits mehrjährige Berufserfahrung in der Medienwelt oder einer Agentur im Gepäck.
Du hast Grundkenntnisse in der Anwendung von qualitativen-empirischen Forschungsmethoden oder Lust, dich darin weiterzuentwickeln.
Du arbeitest selbstständig und kannst dich und dein Projektteam managen.
Du bringst dein Fachwissen aktiv im ganzen Unternehmen ein und unterstützt uns dabei, noch dateninformierter zu arbeiten.
Du kannst präsentieren, moderieren und vielleicht sogar Workshops leiten? Ausgezeichnet!
Dass du für diese Rolle erstklassige Kommunikationsfähigkeiten und auch Empathie brauchst, müssen wir eigentlich hier nicht aufschreiben. Jetzt haben wir’s doch gemacht. Nun ja. Sicher ist sicher.
Du sagst, das könnte passen? Dann lass uns miteinander reden! Schick deine Bewerbung mit deinem Lebenslauf, frühestmöglichem Eintrittstermin und deiner Gehaltsvorstellung direkt an unsere Kollegin Lovis.
Achtung: Bewirb Dich am besten über folgenden Link: https://ida.jobs.personio.de/job/491063?_pc=375499#apply
Art der Stelle: Vollzeit, Teilzeit, Freie Mitarbeit, Festanstellung
Arbeitszeiten:
Montag bis Freitag
Leistungen:
Betriebliche Weiterbildung
Betriebsfeiern
Flexible Arbeitszeiten
Homeoffice
Homeoffice:
Ja",27Dec2021-11:22:14
